Shoneen,Ireland,Irish People,"Irish Person who imitates English Customs. It means ""Little John"" in Irish language, referring to John Bull, a national personification of the British Empire in general and more specifically of England.",[569][570],
Skinny,United States,Somali people,A term most commonly used for Somali militia fighters.,[575],
"Skip, Skippy",Australia,"An Australian, especially one of British descent",Derived from the children's television series Skippy the Bush Kangaroo.,[578],
"Slope, slopehead, slopy, slopey, sloper","Australia, United Kingdom, and United States",Asian people (especially Vietnamese in Australia; especially Chinese in America),"Also slant, slant-eye.",[582][583][584],
Snowflake,United States,White people,Mostly used in this context in the 19th and 20th centuries.,[585],
Smoked Irish/Smoked Irishman,United States,Black people,A 19th-century term intended to insult both blacks and Irish but used primarily for black people.,[513],
Sooty,United States,Black people,Originated in the 1950s.,[591],
"Southern Faerie, Southern Fairy",United Kingdom,Southern English people,"Used in the North of England to refer to someone from the South, alluding to their supposed mollycoddled ways. (see also Northern Monkey.)",[592],
"Spic, spick, spik, spig, or spigotty",United States,Hispanic people,First recorded use in 1915. Believed to be a play on a Spanish-accented pronunciation of the English word speak. May apply to Spanish speakers in general.,[596][597][598][599][600],
Squaw,United States and Canada,Native American women,"Derived from lower East Coast Algonquian (Massachusett: ussqua), which originally meant ""young woman"".",[604][605],
Taffy or Taff,United Kingdom,Welsh people,"First used ca. 17th century. From the River Taff or the Welsh pronunciation of the name David (in Welsh, Dafydd).",[609],
"Taig (also Teague, Teg and Teig)",United Kingdom (primarily Northern Ireland),Irish nationalists,"Used by loyalists in Northern Ireland for members of the nationalist/Catholic/Gaelic community. Derived from the Irish name Tadhg, often mistransliterated as Timothy.",[610][611],
Tar-Baby,United States,Black children,Also used to refer without regard to race to a situation from which it is difficult to extricate oneself. See tar baby.,[622],
"Tinker / tynekere / tinkere / tynkere, -are / tynker / tenker / tinkar / tyncar / tinkard / tynkard / tincker",Britain and Ireland,Lower-class people,"An inconsequential person (typically lower-class) (note that in Britain, the term ""Irish Tinker"" may be used, giving it the same meaning as example as directly below).",[citation needed],
Toad,United States,Black people,Prison slang.,[635],
Tonto,United States,Native Americans,"Native American character in the American television and radio programs The Lone Ranger. Spanish for ""Idiot"".",[637][358],
Twinkie:,United States,"European Americans, Asian Americans","European Americans with few or no social or genealogical links to an indigenous tribe, who claims to be Native American, particularly a New Age practitioner purporting to be a spiritual leader, healer, or medicine man/woman (see also Plastic shaman). Also an Asian American who has become assimilated into mainstream American culture (See Banana, Coconut, and Twinkie).[42]",[650][651][652],
Uncle Tom,United States,Black people,"Refers to black people perceived as behaving in a subservient manner to white authority figures. In South Africa, the term ""Uncle Tom"" has been used as a derogatory slur against coloreds who were perceived as collaborating with the apartheid regime or being subservient to white people. In South Africa, the use of the term ""Uncle Tom"" by black people against coloureds or vice versa is considered racist and discriminatory according to the Promotion of Equality and Prevention of Unfair Discrimination Act.",[659][660],
West Brit,Ireland,Irish people,Directed at Irish people perceived as being insufficiently Irish or too Anglophilic.,[672][673],
Wetback,United States,Undocumented immigrants,"Refers to undocumented immigrants residing in the United States. Originally applied specifically to undocumented Mexican migrant workers who had crossed the United States border via the Rio Grande river to find work in the United States, its meaning has since broadened to any undocumented person who enters the United States through its southern border.",[674],
Wigger / Whigger / Wigga (meaning white nigger),United States,Irish people,"Used in 19th-century United States to refer to the Irish. Sometimes used today in reference to white people in a manner similar to white trash or redneck. Also refers to white youth that imitate urban black youth by means of clothing style, mannerisms, and slang speech. Also used by radical Québécois in self-reference, as in the seminal 1968 book White Niggers of America.",[677],
"White nigger, Nigger wop",United States,Southern Italians,"From the 1800s, inferring such Italians were not ""white"" enough to be allowed citizenship.",[678][679],
White trash,United States,Poor white people,Common usage from the 1830s by black house slaves against white servants.,[680],
Wop,"United States, Canada, United Kingdom",Italian people,"Derived from the Italian dialectism, ""guappo"", close to ""dude, swaggerer"" and other informal appellations, a greeting among male Neapolitans.",[684][685],
Yam yam,United Kingdom,Black Country residents,Term used by people from Birmingham.,[687],
"Zip, Zipperhead",United States,Asian people,"Used by American military personnel during the Korean War and Vietnam War. Also used in the films Apocalypse Now (1979), Platoon (1986), Full Metal Jacket (1987), Romeo Must Die (2000), Gran Torino (2008), and Premium Rush (2012).",[699][700][701],